original_title,overview,year,genre
Brothers O'Toole,"Les frères O'Toole sont des escrocs de l'Est, exceptionnellement bons pour parler de leur chemin dans des situations serrées.Lorsqu'ils montent dans le molybdène, au Colorado, ne soupçonnant pas les richesses sous les rues, ils renversent la ville minière endormie à l'envers pour leur recherche de l'or.Les hijinks à haute enthousiasme s'ensuivent, les frères impliqués dans tout, de l'équipement de jeu volé à un concours ""Belchin ', Cussin' et Spittin '"".",1973,Western
Linda and Abilene,"Au XIXe siècle, les frères et sœurs Abilene et Tod, orphelins dans leur ferme occidentale, sont attirés par les autres, sexuellement.Les puces confuses de Tod dans une ville voisine où il rencontre Linda, une fille de bar locale, et commence une relation sexuelle avec elle, tandis qu'un cow-boy rugueux, nommé Rawhide, agressions sexuellement Abilene conduisant à Tod voulant se venger malgré la méfiance de Linda et la compassion croissante pour Abilene.",1969,Western
Sancharram,"À Sancharram (""The Journey""), Kiran est mortifiée par son désir lesbien croissant de la Delilah effervescente, dans un village indien idyllique où le mariage arrangé est la seule forme de couplage acceptable.",2004,Romance
फ्रीकी अली,"Freaky Ali est un prochain film de rom-com sportif indien 2016 réalisé, produit et écrit par Sohail Khan, coproduit par Nishant Pitti, avec un dialogue de Raaj Shaandilyaa et présenté par Salman Khan.Il est inspiré par Happy Gilmore d'Adam Sandler (1996) et devrait sortir le 9 septembre 2016.",2016,Romance
The Alamo,"Basé sur l'impasse de 1836 entre un groupe d'hommes texan et Tejano, dirigé par Davy Crockett et Jim Bowie, et les forces du dictateur mexicain Santa Anna à l'Alamo à San Antonio, au Texas.",2004,Western
God of Love,Un champion de fléchettes amoureux et de la chute de salon trouve que ses prières sont répondues - littéralement - quand il reçoit mystérieusement une boîte de fléchettes induisant l'amour.,2010,Romance
Bandolero!,"Se faisant passer pour un bourreau, Mace Bishop arrive en ville dans l'intention de libérer un gang de hors-la-loi, y compris son frère, de la potence.Mace exhorte son jeune frère à abandonner le crime.Le shérif poursuit les frères au Mexique.Ils unissent cependant leurs forces contre un groupe de bandits mexicains.",1968,Western
Hot Lead & Cold Feet,"Twin Brothers - l'un rugueux et dur, l'autre d'un milquetoast élevé en ville - rivalise pour la fortune de leur père.",1978,Western
Far and Away,"Un jeune homme (croisière) quitte l'Irlande avec la fille de son propriétaire (Kidman) après quelques problèmes avec son père, et ils rêvent de posséder des terres au grand cadeau de l'Oklahoma CA.1893. Lorsqu'ils arrivent sur le nouveau terrain, ils trouvent des emplois et commencent à économiser de l'argent.L'homme devient un boxeur local à nu et se rend dans la gloire jusqu'à ce qu'il soit battu, puis ses employeurs volent tout l'argent du couple et ils doivent combattre la famine en hiver et essayer de garder leur rêve de posséder une terre en vie.Pendant ce temps, les parents de la femme découvrent où elle est allée et est venue en Amérique pour la retrouver et la reprendre.",1992,Western
Lone Rider,"Bobby Hattaway (Lou Diamond Phillips), un soldat honoré, rentre chez lui après la guerre civile américaine pour trouver le ranch anciennement prospère de son père (Stacy Keach), dangereusement endette).Bobby va maintenant affronter son ancien ami pour prendre le contrôle de Stu.",2008,Western
The Good Old Boys,Un cow-boy vieillissant doit choisir entre son désir de rester libre et les responsabilités de maintenir une famille.,1995,Western
Replica,"Souffrant d'insuffisance rénale, Joe, un vendeur de puces informatiques passe par une greffe d'organe administrée par le Dr Evelyn Tyler qui est biogéticien pour la technologie thérapeutique située à 1 ADN Drive.Joe n'est pas seulement reconnaissant pour son nouveau rein, mais il s'intéresse et obsédé par le Dr Tyler qui lui montre le monde de la biotechnologie miraculeuse, incroyable et merveilleuse.Mais cette panacée apparemment technologique est également remplie d'incertitude, de danger et de dilemme qui change leur vie pour toujours.",2005,Romance
Slow West,"Dans le Old West, un écossais de 17 ans fait équipe avec un mystérieux tireur pour trouver la femme avec qui il est passionné.",2015,Western
Fifty Shades Darker,"Lorsqu'un blessé Christian Gray essaie d'attirer un Ana Steele prudent dans sa vie, elle exige un nouvel arrangement avant qu'elle ne lui donne une autre chance.Alors que les deux commencent à renforcer la confiance et à trouver la stabilité, les personnalités sombres du passé de Christian commencent à encercler le couple, déterminées à détruire leurs espoirs pour un avenir ensemble.",2017,Romance
L'Homme de Chevet,"Muriel est magnifique, libre d'esprit et traversée de lit depuis un horrible accident.Leo est un ex-boxer ivre d'âge moyen.Désespéré pour le travail et non qualifié, il interroge pour Muriel, qui l'embauche pour cuisiner et s'occuper d'elle contre son meilleur jugement.Initialement hors de sa profondeur, Leo gagne lentement la confiance de Muriel.Alors que Muriel lui apprend à lire, il l'oblige à affronter les joies au-delà de sa fenêtre.",2009,Romance
My Little Chickadee,"Situé dans l'ancien américain à l'ouest des années 1880, Mlle Flower Belle Lee (Mae West) est en passe de rendre visite à des parents à l'ouest.Pendant qu'elle voyage sur une diligence, un bandit masqué à cheval tient la scène pour son envoi d'or.Alors qu'il fait son escapade avec l'or, il emmène Flower Belle avec lui.Flower Belle entre alors en ville sous suspicion d'être en collusion avec le bandit.",1940,Western
La collina degli stivali,Les victimes du patron de la ville oppressive Honey se voient offrir de l'aide d'une alliance inhabituelle d'hommers armés et d'interprètes de cirque,1969,Western
Gunfighter's Moon,"Henrickson incarne Frank Morgan, un gunfighter notoire et redouté qui a vécu sa vie en fuite.Son visage et ses yeux révèlent un homme qui a été très durci par cette vie.Nous apprenons rapidement, cependant, qu'il y a encore de la passion à l'intérieur.En recevant un télégramme de Linda, un vieil amoureux (joué par Kay Lenz), demandant sa présence, il abandonne sa femme, monte son cheval et se rend à Linda sans y réfléchir.À son arrivée, il apprend que Linda est maintenant mariée avec le propriétaire du magasin général local.Le seul vestige de son passé qui reste est une fille, que Frank est surpris d'apprendre est la sienne.Écrit par Dave Gan",1997,Western
World Without End,La ville anglaise de Kingsbridge travaille pour survivre alors que le roi mène la nation dans la guerre de cent ans avec la France tandis que l'Europe traite de l'épidémie de la mort noire.,2012,Romance
Tension at Table Rock,"Lorsque le propriétaire d'une station de diligence est tué, un tireur prend sa place.",1956,Western
Wanted,"Giuliano Gemma, élu shérif par sa petite ville, est injustement accusé de meurtre et contraint de fuir.L'homme derrière la fausse charge est une figure luride qui mène une bande de rouilleurs de bétail.Notre héros essaie de prouver son innocence en se débarrassant de ses ennemis un par un.-From http://www.spaghetti-estern.net",1967,Western
From Noon Till Three,"Le voleur de banque Graham Dorsey passe quelques heures avec la belle veuve Amanda Starbuck, à laquelle son gang participe à un holdup désastreux.Apprenant la disparition de ses camarades, Dorsey va sur le Lam.Croyant que son amant à court terme a été tué par la loi, Amanda décide de tirer le meilleur parti de la liaison avec le desperado prétendument décédé en écrivant un livre à son sujet.À sa grande confusion, le Dorsey qui vit encore vivant comme son nom devenir légendaire.",1976,Western
The Great Northfield Minnesota Raid,"Les gangs de Jesse James et Cole Younger unissent leurs forces pour voler la première banque nationale à Northfield, Minnesota, mais les choses ne se déroulent pas comme prévu.",1972,Western
Hopeless Romantic,"Matt Matt (Brandon W. Jones) désespéré décide qu'il est temps de poser la grande question à sa petite amie, Alexis (Cassi Thomson).Avant la grande soirée, il pratique sa proposition sur son meilleur ami, Liz (Christa B. Allen).Matt pense que s'il suit les règles de toutes ses comédies romantiques préférées, il a garanti un «oui!»À la consternation de Matt, Alexis le rejette doucement en déclarant qu'il est seulement intéressé par l'idée d'être amoureux et non une vraie relation.Après cette catastrophe inattendue, Matt Binge regarde une rom-com après l'autre et propose un plan pour reconquérir Alexis.Bien que Liz pense que le plan de Matt est absurde, elle accepte d'être son ailier.L'opération pour raviver sa relation semble ne fonctionner que pour que Matt affronte la réalité que lui et Alexis ont peut-être éclaté et que son cœur appartient ailleurs.",2016,Romance
Nude Area,"Naomi, une fille néerlandaise de quinze ans de South-Amsterdam, développe un béguin pour une belle fille arabe du même âge vivant dans les pauvres quartiers d'Amsterdam West.Au cours d'un été magique à Amsterdam, les deux filles jouent un jeu d'échecs émotionnel d'amour, de séduction et d'attraction.",2014,Romance
Buckskin Frontier,Un chemin de fer et le propriétaire d'une bataille de ligne de marchandises pour le contrôle d'un col crucial de montagne.,1943,Western
A Wish for Christmas,"Sara Shaw est le type de femme qui préfère s'asseoir sur la touche au travail, mais quand sa grande idée pour une initiative de Noël est volée, elle fait un souhait au Père Noël qu'elle aura enfin le courage de se défendre.Le Père Noël répond à son souhait, mais ne lui donne que 48 heures.Alors que l'horloge coche, Sara découvrira comment canaliser la magie de Noël et parler son esprit tout seul.",2016,Romance
Lone Wolf McQuade,"Le Renegade archétypique du Texas Ranger fait la guerre à une cheville ouvrière de drogue avec des armes automatiques, ses esprits et ses arts martiaux après une bataille d'armes à feu qui a laissé son partenaire mort.Tout cela culmine inévitablement une confrontation en arts martiaux entre le Seigneur de la Drogue et le Ranger, et impliquant la femme qu'ils aiment tous les deux.",1983,Western
The Far Horizons,Les États-Unis viennent d'acquérir la Louisiane depuis la France.Une expédition dirigée par Lewis et Clark est envoyée pour étudier le territoire et aller là où aucun homme blanc n'est allé auparavant.Sont-ils capables de surmonter les dangers avec l'aide de Sacajawea?,1955,Western
The Villain Still Pursued Her,"Le mélodrame victorien obtient un gros envoi dans cette production de l'ancienne pièce de l'ancienne ""l'ivrogne; ou, les déchets sauvés"".La pièce dans le film est l'ancienne où le méchant méchant cribbs schémas pour obtenir ses griffes vigoureuses sur l'héroïne en conduisant son mari naïf à la ruine alcoolique.Heureusement, un professeur de tempérance est sur place pour mettre les choses à droite, tout comme le grand Buster Keaton en tant que frère de l'ivrogne.",1940,Romance
Love's Everlasting Courage,"Clark Davis a du mal à maintenir ses terres et à soutenir sa famille pendant une longue sécheresse.Avec un prêt bancaire à rembourser, sa femme, Ellen, prend un emploi en ville en tant que couturière, mais tombe rapidement malade avec la fièvre écarlate.Dévasté de perdre sa femme bien-aimée, Clark et sa jeune fille Missie se tournent vers ses parents Irene et Lloyd pour leur soutien.Clark doit trouver un moyen de sauver sa ferme et de survivre à la mort d'Ellen sans perdre la personne qu'il aime le plus: sa fille.",2011,Western
Raw Edge,Un Texan arrive dans l'Oregon et cherche justice à son frère innocente,1956,Western
The Ice Princess,"C'est une autre variation de l'histoire de Cendrillon: la brillante et belle Ella vit dans la maison d'un seigneur depuis la mort de sa mère.Elle est mécontente parce que les filles du Seigneur la traitent comme leur serviteur.Le pays est en problème, car le prince est un rêveur et ne se rend pas compte que son chancelier abuse de son pouvoir.Lorsque la journée approche, le prince est forcé par la loi de trouver une femme, une célébration sur un lac gelé est organisée.Ella parvient à patiner sur le lac pour lui aussi, cachant son identité.Le prince tombe amoureux d'elle, alors il essaie de la trouver.Son chancelier tente de les gêner, car il connaît les pensées critiques d'Ella.",1996,Romance
The Rainmaker,"Lizzie Curry est sur le point de devenir une vieille femme de chambre sans espoir.Son esprit, son intelligence et ses compétences en tant qu'aumeure ne peuvent pas compenser le fait qu'elle est tout simplement simple!Même le shérif de la ville, dépose, pour qui elle abrite un yen secret, ne prendra aucune chance --- jusqu'à ce que la ville subisse une sécheresse et dans la vie de Lizzie et de ses frères et père vient un Bill Starbuck ... Profession:Faiseur de pluie!",1956,Western
Crazy Eyes,"Zack (Haas) est un jeune père divorcé qui commence à développer des sentiments romantiques envers son amie Rebecca (Zima), qu'il appelle des ""yeux fous"".Il passe beaucoup de temps dans un bar dirigé par son meilleur ami Dan Drake (Busey) et traînant avec l'automne (Raymonde).Alors qu'il poursuit une relation sexuelle avec Rebecca, Zack devient de plus en plus conscient de l'importance du rôle de son fils dans sa vie au milieu de la santé défaillante de son propre père.",2012,Romance
The Man Who Came Back,"Encadré pour meurtre et laissé pour mort, une légende locale revient pour faire le paiement coupable alors qu'il cherche à se venger de ceux qui ont tué sa famille, dans cet occidental traditionnel à propos d'un homme qui s'est opposé à l'injustice.",2008,Western
The Castaway Cowboy,Cowboy Wayward Texas (James Garner) se lave sur les plages d'Hawaï et est ramené à la maison par un garçon sans père.Il sauve les affaires de la famille tout en romancant la maman célibataire (Vera Miles).,1974,Western
Future My Love,"Réalisé et raconté par Maja Borg, Future My Love est une histoire d'amour unique contestant nos utopies collectives et personnelles à la recherche de la liberté.",2012,Romance
Desamuduru,"Desamuduru (Telugu: దేశముదురు) est un film Telugu 2007, doublé en malayalam et tamoul en tant que héros: le vrai héros et hindi en tant qu'Ek Jwalamukhi.Le film a Allu Arjun et Hansika Motwani en tête.Le film a été réalisé par Puri Jagannadh.D.V.V.Danaiah a produit Desamuduru sous la bannière des médias universels.Le film est sorti le 12 janvier 2007 dans 400 théâtres",2007,Romance
The Indian Fighter,Un éclaireur menant un train de wagons à travers un pays indien hostile s'implique involontairement avec la fille d'un chef de Sioux,1955,Western
Celal ile Ceren,"Celal, qui rêve d'atteindre le bonheur en tant qu'homme et charmeur de dames, se lance bientôt dans des difficultés et souffre d'un malheur.À l'époque où Celal était en couple, il était jaloux de la vie d'un baccalauréat.",2013,Romance
Lost in Florence,"Eric Lazard est une ancienne star du football universitaire au cœur brisé qui s'implique dans un dangereux sport florentin et une femme locale, Stephanie, tout en visitant sa cousine Anna, qui vit en Italie et enseigne la langue italienne aux étrangers.",2017,Romance
ฟรีแลนซ์,Un pigiste travailleur dur qui tombe amoureux d'un médecin.Tandis que sa vie s'aggrave à chaque seconde.Il doit trouver le moyen de libérer sa vie au-delà de tout.,2015,Romance
Quel maledetto giorno della resa dei conti,"George Benton revient de l'école à la ferme de son frère Jonathan en tant que médecin et épouse son fiancé Lory, mais le bonheur ne dure pas longtemps.Les frères Fargas fournissent un bain de sang dans le ranch et sont capables de détourner les soupçons d'eux-mêmes sur un gang de hors-la-loi, mais l'une des familles a survécu au massacre et sait qui sont les vrais tueurs.",1971,Western
Just the Way You Are,"Lorsqu'un mariage d'un entremetteur professionnel perd son étincelle, elle cherche à recharger la relation en demandant à son mari à un rendez-vous aveugle.À l'approche de la fête des mères et que leur romance commence à raviver, elle se demande si son mari axé sur la carrière apprend enfin à mettre les besoins de sa famille avant son travail.",2015,Romance
Love Finds A Home,"Dans cette suite, Lillian a été adoptée et c'est plusieurs années plus tard.Annie, mariée et enceinte, rend visite à son collègue ami, le Dr Owen.Le Dr Owen veut désespérément un bébé, mais semble incapable de devenir enceinte.Lillian trouve un intérêt amoureux, assistante de son père adoptif, ce dernier est devenu assez surprotecteur.",2009,Western
Renegade,"Lors de ses voyages à travers le sud-ouest des États-Unis, avec sa Jeep CJ Renegade et son poulain de châtaigne nommé Joe Brown, Luke rencontre Matt, fils d'un de ses amis, Moose, qui est en prison.Moose demande à Luke de prendre soin de Matt et de l'aider à prendre possession d'un terrain.Alors commence leur voyage, plein d'aventures ...",1987,Western
Navajo Joe,Le seul survivant d'un massacre sanglant promet de se venger de ses agresseurs et des hommes qui ont tué sa femme.,1966,Western
The First Texan,"Après son arrivée au Texas pour échapper à un scandale dans l'est, l'avocat Sam Houston veut juste sortir son bardeau, garder un profil bas et rester en dehors de toute intrigue politique.Cependant, lorsque le président Jackson lui ordonne personnellement de mener la lutte pour l'indépendance texane, il surmonte sa réticence à s'impliquer et conduit ses compatriotes à une série de victoires sur l'armée mexicaine.",1956,Western
Surprised by Love,L'histoire d'une jeune femme d'affaires qui essaie de convaincre ses parents tendus d'accepter son petit ami actuel et se retrouve à tomber dans une vieille flamme de lycée.,2015,Romance
Winds of the Wasteland,L'arrivée du Telegraph a mis des coureurs Pony Express comme John Blair et son copain qui fume du travail.Une course décidera si le propriétaire ou le propriétaire de Stageline Drake obtient le contrat de courrier gouvernemental.,1936,Western
El siete machos,"Rosario, la nièce de l'éleveur, revient au ranch après dix ans d'absence.Elle accueille Margarito, une travailleuse du ranch, qui est immédiatement frappée par elle.Rosario est sauvé d'un cheval en fuite par les sept hommes, un hors-la-loi à la Robin Hood qui vole aux riches et donne aux pauvres.Il se trouve également être le frère jumeau de Margarito, à son insu.La confusion entre Margarito et les sept hommes génère de grandes situations comiques dans le film.",1951,Western
I'll Take You There,Une femme oblige un homme à aller de l'avant avec sa vie après que sa femme l'a largué.,1999,Romance
Il raggio infernale,"Danger Death Ray, le plus drôle des films d'espion ringard avec lesquels MST s'est amusé.L'ancien Tarzan Gordon Scott suce son instinct pour celui-ci.Le professeur Carmichael a développé un rayon de mort ""à des fins paisibles uniquement"", mais un vague groupe de méchants le veut à la place, il est donc kidnappé par des gars pâteux et emmené dans leur sous-jouet (via un hélicoptère jouet) Bart Fargo doit le sauver car il est leSeul American Spy qui a l'air bien dans les lunettes de soleil féminines.Cool Music l'accompagne alors qu'il cherche Carmichael alors qu'il doit faire face à Evil Abe Lincolns, à un méchant fey, un ami à l'écoute de Fargo et de quelques femmes avec lesquelles il doit coucher.En fin de compte, le méchant inefficace est tué, le professeur et le rayon de la mort sont secourus et Bart obtient la femme.Il y a aussi une scène complexe avec une montre lancée dans une piscine qui symbolise le temps qui a été perdu sur l'écriture d'écran intelligente pour le film.",1967,Romance
夏洛特烦恼,Un perdant d'âge moyen revient dans le temps dans ses années de lycée pour mettre sa vie sur la bonne voie.,2015,Romance
Arizona Raiders,"Murphy incarne un ex-Raider d'un Raider qui est libéré de prison avec Buddy Cooper pour être député en tant que Rangers de l'Arizona afin de traquer le reste du gang, il se cache dans une ville ""Neer Dee Border"" dans les mots du Loose-Danceur de salon taillé.Les hommes de main se trouvent dans une mission indienne.Murphy et Cooper font semblant de vouloir rejoindre le gang, mais les méchants s'assurent et battent brutalement Cooper, qui protège la mort de Murphy à la mort.",1965,Western
Preparati la bara!,"Un mystérieux combattant du pistolet nommé Django est employé par un patron politique tordonné local en tant que bourreau pour exécuter des habitants innocents encadrés par le patron, qui veut leur terrain.Ce que le patron ne sait pas, c'est que Django ne suspend pas du tout les hommes, donnant juste à ce qu'il soit, et en utilisant les hommes qu'il sauve de la potence pour construire son propre ""gang"" afin de se vengerLe patron, qui, avec l'ancien meilleur ami de Django, a causé la mort de sa femme des années auparavant.",1968,Western
Suburban Mayhem,"Pouvez-vous vraiment vous en sortir avec le meurtre?Bienvenue dans le monde de Katrina, une maman célibataire de 19 ans qui prévoit de faire exactement cela.Katrina vit dans un monde de délits petits, de voitures rapides, de manucures et de talons.Un maître manipulateur d'hommes vivant à la maison avec son père dans la banlieue de Golden Grove, Katrina ne s'arrête à rien pour obtenir ce qu'elle veut - même le meurtre.",2006,Romance
Apache Territory,"Logan Cates (Rory Calhoun) entreprend de sauver une femme blanche capturée par les Indiens d'Apache et d'empêcher une guerre.Sur le chemin, il est rejoint par quelques civils et une petite bande de soldats dans un trou d'eau.Ils sont pris en embuscade et assiégés par Apache.Alors que leur alimentation et leur approvisionnement en eau diminuent, une tempête arrive, ce qui permet à Cates de mettre un plan d'évasion en action.",1958,Western
A Man Called Sledge,"James Garner est Luther Sledge, le chef d'une meute de rebelles qui prévoient de voler une réserve d'or.Mais après que les voleurs parviennent à s'enfuir avec la prime, ils découvrent bientôt que l'ennemi se trouve au milieu d'eux.Alors qu'ils commencent à se chamailler sur qui devrait obtenir la plus grande coupe, la scène est prête pour une confrontation mortelle.Claude Akins et John Marley co-star dans cet Occidental italien réalisé par Vic Morrow.",1970,Western
Posse,"Un maréchal dur avec des ambitions politiques conduit un groupe d'élite à capturer un criminel notoire.Il réussit, mais au lieu de l'encourager, le public se retourne contre lui.",1975,Western
Bone Tomahawk,"Lors d'une fusillade dans un salon, le shérif Hunt blesse un inconnu suspect.L'un des villageois prend soin de lui en prison.Un jour, ils disparaissent tous les deux - seule la lance d'une tribu cannibale est trouvée.Hunt et quelques-uns de ses hommes partent à la recherche du prisonnier et de son infirmière.",2015,Western
Cat Ballou,"Une femme cherchant à se venger de son père assassiné engage un célèbre armé, mais il est très différent de ce qu'elle attend.",1965,Western
Lo chiamavano Trinità...,"L'histoire simple a le couple à la rescousse des mormons qui aiment la paix lorsque le major de terre Harriman envoie ses intimidateurs pour les harceler pour abandonner leur vallée fertile.Trinity et Bambino parviennent à sauver les mormons et à envoyer les méchants emballés avec de l'humour slapstick au lieu d'une violence excessive, sauvant la journée.",1970,Western
Bitter Creek,"""Wild"" Bill Elliott est un cow-boy qui part à la recherche de l'homme qui a tué son frère et se retrouve dans la petite ville de Bitter Creek.",1954,Western
Gun Glory,Un ex-gunslinger (Stewart Granger) évité par Townsfolk est le seul à savoir comment arrêter un hattleman impitoyable.,1957,Western
Pirates of the Prairie,"Dans l'un de ses meilleurs occidentaux, Tim Holt, en tant que maréchal adjoint Larry Durant, est envoyé à Spencerville où un gang de justiciers a terrorisé les citoyens.En tant qu'intermédiaire en tant qu'armée, Larry apprend rapidement que le chef des vigilants, John Spencer (John Elliott), est un homme honnête qui ne cherche qu'à établir la loi et l'ordre.Les véritables cerveaux derrière les crimes, quant à eux, se révèlent être le beau-frère de Spencer, Lou Harmon (Roy Barcroft), et son chef de main, Leighton (Charles King), qui spéculent dans la venue du chemin de fer en forçant les citadinspour abandonner leur terre.",1942,Western
Naked Gun,"Don Pablo Salazar vole une fortune dans les bijoux d'une tribu indienne et un médecine aztèque met une malédiction sur les bijoux jusqu'à leur retour.Des années plus tard, un assurance américaine promet de livrer la fortune de Salazar à l'héritier légitime ...",1956,Western
California,"""Wicked"" Lily Bishop rejoint un train de wagons en Californie, dirigé par Michael Fabian et Johnny Trumbo, mais la nouvelle de la ruée vers l'or disperse le train.Lorsque Johnny et Michael arrivent enfin, Lily est riche de son salon et de son commerçant (ancien esclavier) Pharaon Cercer saigne les mineurs secs.Mais de pire problèmes sont en avance: la Californie monte vers l'État, et certaines personnes veulent en faire leur empire privé.",1947,Western
