original_title,overview,year,genre
¡Mátalo!,"Un gang de voleurs de bétail sauve un criminel de la potence, puis volez plus tard une diligence chargée d'or.Quand ils obtiennent le butin, il est trahi et laissé mourir au milieu du désert.Dans l'évasion, ils atteignent une mystérieuse ville fantôme, où ils perçoivent qu'il y a quelque chose d'étrange ...",1970,Western
Eega,"Sudeep est un industriel de haut niveau qui obtient ce qu'il veut et il a un œil spécial pour les belles femmes.Pour les obtenir, il n'hésitera pas à faire quoi que ce soit.Ce désir est déclenché lorsque Sudeep voit Bindu, un micro-artiste qui dirige une organisation à but non lucratif.Cependant, Bindu est aimé par Nani qui continue de la suivre partout.Bien que Bindu l'aime, elle ne lui exprime pas et aime l'attention.L'histoire prend un tour lorsque Sudeep découvre les sentiments de Bindu pour Nani et n'est pas en mesure de digérer sa défaite.Il tue Nani.Mais Nani est né de nouveau en tant que «eega» (mouche) et il veut se venger de Sudeep.",2012,Romance
Un dollaro tra i denti,"À l'insu de personne d'autre que lui-même, l'étranger arrive dans une ville abandonnée où il est témoin du massacre des soldats mexicains par un gang dirigé par Aguila.L'étranger menace Aguila de le dénoncer s'il n'accepte pas de le laisser participer au vol d'une expédition d'or.Le plan est un succès mais lorsque l'étranger revendique son dû, il obtient un bon coup à la place.Cependant, l'étranger parvient à s'échapper avec l'or.Les bandits, qui veulent sa peau, le poursuivent.Mais l'étranger n'est pas du genre à se faire prendre si facilement ...",1967,Western
Лісова пісня. Мавка,"Mavka, une nymphe d'eau, aime Lukash, un jeune country.Leur bref bonheur se termine lorsque Lukash est obligé d'épouser la kilina mince.L'esprit de la forêt transforme Lukash en loup comme punition pour son infidélité.La force de l'amour de Mavka brise le sort, mais Kilina maudit la nymphe, la transformant en un saule pleureur.Cette histoire belle et tragique est basée sur une pièce écrite en 1912 par Lesya Ukrainka, poète ukrainien, écrivain et politique, civil et féminin, et comprend des personnages mythologiques tirés du folklore ukrainien.",1980,Romance
The Squaw Man,"Blamed pour le vol d'un fonds orphelin, le capitaine James Wynnegate s'enfuit vers l'ouest où il fait une nouvelle vie avec la femme indienne Nat-U-Rich",1914,Western
Before You Say 'I Do',"La fiancée de George Murray, Jane Gardner, obtient des pieds froids après avoir accepté sa bague, terrorisée par son premier mariage avec Doug, qui a triché ce jour-là avec leur coordinateur de mariage.Après un accident de voiture, George se retrouve 10 ans dans le passé, quelques jours avant la journée de Doug.",2009,Romance
Un amour de femme,"Jeanne assiste à la fête d'anniversaire d'un ami de son mari.Là, elle rencontre une danseuse nommée Marie et il y a une chimie instantanée entre eux.Jeanne tombe amoureuse de Marie et ils se lancent dans une affaire extraconjugale.La relation est terminée lorsque Jeanne dit à son mari et il la fait choisir entre eux.Puisqu'il y a un enfant impliqué, Jeanne décide d'abord de rester avec David.Plus tard, elle se rend compte de l'erreur qu'elle a commise.",2001,Romance
Friendly Persuasion,"L'histoire d'une famille de Quakers dans l'Indiana en 1862. Leur secte religieuse est fortement opposée à la violence et à la guerre.Il n'est pas facile pour eux de respecter les règles de leur religion dans la vie quotidienne, mais lorsque les troupes du Sud passent la zone, elles sont réelles.Devraient-ils se battre, malgré leur attitude paisible?",1956,Western
The Law and Jake Wade,"Jake Wade casse Hollister en prison pour rembourser une vieille dette, bien qu'il soit clair qu'il y a une hostilité assez profonde entre eux.Ils se séparent et Jake revient au travail de son maréchal de petite ville et à sa fiancée pour découvrir qu'il y a été suivi par Hollister.Il semble qu'ils soient une fois dans un gang ensemble et Jake sait où sont cachés le produit d'un titulaire de banque.Hollister et ses acolytes se rendent dans les collines, emportant le maréchal en trussed et sa future épouse kidnappée pour forcer le législateur à leur montrer où se trouve le butin.",1958,Western
Space Mutiny,"Un pilote est le seul espoir d'arrêter la mutinerie d'un vaisseau spatial par son équipe de sécurité, qui complote pour vendre l'équipage du navire dans l'esclavage.",1988,Romance
FREEDOM,"En 2041, l'humanité a créé sa première colonie spatiale sur la lune.Mais après un cataclysme bizarre a dévasté la civilisation humaine sur Terre, la République de la Lune a construit une mégalopole en forme de dôme connue sous le nom d'Eden.Maintenant, en l'an 2267, un garçon appelé Takeru passe son temps à s'engager dans des courses de volant contre les gangs de rue rivaux, ignorant qu'il est sur le point de se lancer dans le voyage de dénicher l'origine d'Eden.",2006,Romance
The Missouri Traveler,"Brandon Dewilde mène un long des acteurs de personnage de la distribution jouant Byron Turner, un émouvant de 15 ans de l'asile orphelin d'Eatondale à destination de la Floride pendant la période de la guerre avant le monde I.Il reçoit un tour dans la ville rurale du Missouri de Delphi avec un riche propriétaire terrestre Tobias Brown (Lee Marvin).Là, après un épisode sur la place de la ville impliquant la majeure partie de la population, il rencontre le journal croustillant, l'homme Doyle Magee (Gary Merrill).Ces deux hommes partagent un intérêt pour la jeunesse polie et mature;L'un montrant la gentillesse, l'autre presque toute la cruauté.Finalement, leur raisonnement devient clair pour le garçon.Dans le même temps, toute la ville de Delphi en vient non seulement à accepter Byron, mais à l'embrasser comme l'un des propres villes et son rêve de devenir agriculteur.Source: http://en.wikipedia.org/wiki/the_missouri_traveler",1958,Western
ボーイズ・オン・ザ・ラン,"Ce n'est pas souvent qu'une histoire de passage à l'âge adulte tourne autour d'un masturbateur chronique de 29 ans qui vit toujours avec sa mère, mais ce n'est qu'un exemple des nombreuses façons dont les garçons de Daisuke Miura en fuite sont rafraîchissants.Le film est basé sur un manga de Kengo Hanazawa qui a été à l'origine sérialisé dans les grands esprits de la bande dessinée de Shogakukan de 2005 à 2008, et bien que l'adaptation soit assez fidèle visuellement, le ton général a été modifié à la fois dans la façon dont les personnages se comportent et comment l'histoire est visuellementest présenté.",2010,Romance
Perfect on Paper,"La rédactrice en chef du livre de Portland, Natalie Holland, a choisi le mauvais gars - un autre sous-performant - encore une fois.Avec sa vie nulle part vite, elle accepte une offre d'emploi de l'éditeur et amie Avery Goldstein et déménage à Los Angeles.Femme de profondeur et de principe, Portland Chic Natalie est un poisson hors de l'eau à Los Angeles.Les choses ne font qu'empirer lorsqu'elle apprend qu'elle a été embauchée pour éditer le dernier roman romantique de l'auteur à succès Beverly Wilcox, une figure puissante, glamour et intimidante tout droit sorti de ""The Devil Wears Prada"".",2014,Romance
The Third Party,"Andi, une aspirante créatrice de mode, essaie de reconquérir son premier ex-ex-Beau, Max, un chirurgien.Andi pensait que son plan pour gagner le cœur de Max se déroulera bien, mais Max a trouvé un nouvel amour à un pédiatre gay nommé Christian.",2016,Romance
Στέλλα,"L'histoire d'une jeune femme sauvage qui ne veut pas compromettre et s'installer.Stella est une femme grecque agitée et rebelle qui joue avec des hommes et aime sa vie autant qu'elle le peut.Mais quand elle rencontre une jeune joueuse de football, les choses se mélangent.Elle l'aime mais elle aime aussi sa liberté.Il est donc temps qu'elle fasse un choix important.",1955,Romance
Borrowed Time,"Un shérif altéré revient aux restes d'un accident qu'il a passé une vie à essayer d'oublier.À chaque pas en avant, les souvenirs reviennent.Face à son erreur une fois de plus, il doit trouver la force de continuer.",2015,Western
Enamorada,"À l'époque de la révolution mexicaine, une guérilla et ses troupes prennent la ville conservatrice de Cholula, près de Mexico.Alors que les révolutionnaires maltraitent les richesses de la ville, Armendáriz tombe pour Beau et sauvage Beatriz Peñafiel, la fille de l'un des hommes les plus riches de la ville.",1946,Romance
Mastizaade,Deux célibataires féministes tombent amoureux des sœurs jumelles qui dirigent une clinique de dépendance sexuelle.,2016,Romance
Paperback Hero,"Jack Willis est un beau conducteur du road-grain avec un secret - il vient de devenir un romancier romantique le plus vendu.Cependant, étant un «homme de l'homme» dans les perspectives australiennes, pour éviter l'embarras, il a besoin d'un nom, d'un nom de femme - et il choisit celui de son meilleur ami, Ruby Vale.Il doit faire un jeu de jambes sophistiqué pour continuer la charade lorsque l'éditeur glamour de la ville, Ziggy, arrive dans Dusty Outback Lucktown pour signer «Ruby Vale» à un grand accord de livre.Ruby accepte d'aider Jack bien que ce soit également pour son propre gain - l'éditeur paiera son mariage à venir (avec Hamish, Jack's Buddy).Accompagné de Jack, Ruby se rend à Sydney pour rencontrer les médias, apparaît à la télévision et aux cocktails, etc. progressivement, Jack se rend compte qu'il est tombé amoureux de Ruby, tandis que Ruby est également touchée par le roman de Jack.Cependant, Hamish arrive à Sydney quelques jours plus tard et demande aux deux d'arrêter toutes ces choses stupides",1999,Romance
Socha Na tha,"Un garçon qui a forcé de ""voir"" une fille avec laquelle il doit se marier.Mais la fille et le garçon suivent les contraintes qu'ils ont faites lors de leur première rencontre et, malheureusement, n'ont pas pu la suivre.",2005,Romance
Montana,"Un homme de mouton australien vient au Montana à la recherche d'un espace de pâturage, est opposé par des éleveurs locaux et une riche femme de bétail.",1950,Western
Living on Love,"Un homme et une femme, qui ne se sont jamais rencontrés, sont forcés par des circonstances à partager le même appartement.Un remake du film de 1933 ""Rafter Romance"".",1937,Romance
野玫瑰,Une fille de la campagne sauvage déménage à Shanghai avec son petit ami peintre et éprouve l'exploitation et la pauvreté.,1932,Romance
John Apple Jack,"Un Playboy apprend à aimer, tandis qu'une vierge apprend à vivre - une comédie romantique queer se déroulant à l'intérieur de l'industrie de la restauration ... 'John Apple Jack' rassemble l'est et l'ouest pour créer un plat somptueux.Lorsque John découvre que le fiancé de sa sœur est Jack, son écrasement d'enfance, les passions s'enfoncent et sa vie devient incontrôlable ... perdant son emploi, sa réputation de playboy et ses sous-vêtements, tout en se précipitant vers l'autel pour enfin confesser son amour!",2013,Romance
空中庭園,"Pour son quatrième long métrage complet, Toyoshi Toyoda a abandonné le thème du jeune homme en colère, examiné en profondeur dans Pornostar, Blue Spring et 9 Souls.Kuchu teien est, à première vue, plus un drame, une étude de personnage, qu'un film typique de genre Toyoda.Pourtant, dans ce film magnifiquement structuré et photographié, il se trouve une âme sombre.En apparence, l'histoire d'une famille heureuse, elle devient de plus en plus claire à mesure que le film progresse que les Kyobashis sont tout sauf.Malgré un accord familial qu'ils sont tous ouverts les uns avec les autres, toute la maison sait que le contraire est vrai.",2005,Romance
Ride Beyond Vengeance,"Jonas Trapp tombe amoureux de la belle Jessie, une fille riche de son humble classe.Contre les souhaits de sa tante snob, elle l'épouse, truquant plus tard une grossesse pour gagner le consentement de sa tante.Mais Jonas se lasse de vivre de la famille de sa femme, et finalement la déserte pour devenir un chasseur de buffles.11 ans plus tard, avec sa fortune autodidacte, il entreprend de rentrer chez lui, pour être fixé par trois maraudeurs sadiques, qui volent son argent et le laissent mort.Sauvé par un agriculteur qui le nourrit à la santé, Jonas devient consommé par le désir de vengeance.Comme le destin l'aurait fait, les trois hommes vivent près de l'ancienne maison de Jonas.Les choses empirent rapidement lorsque Jonas retrouve sa femme, seulement pour découvrir qu'elle est maintenant fiancée à Renne.",1966,Western
Les Aventuriers,"Deux aventuriers et meilleurs amis, Roland et Manu, sont les victimes d'une blague pratique qui coûte à Manu sa licence de pilote.Avec une contrition apparente, les blagues parlent à Roland et Manu d'un avion écrasé allongé sur le fond de l'océan au large du Congo farcis de richesse.Les aventuriers sont partis pour trouver le butin.",1967,Romance
大いなる幻影,"Dans un avenir proche où les allergies sont devenues une épidémie, le producteur de musique Haru sort sans enthousiasme le greffier du bureau de poste et le voleur de courrier Michi.Il cherche des moyens violents de réactiver sa vie, elle rêve de s'échapper à l'étranger;Les deux se portent volontaires pour tester un nouveau médicament qui peut fournir un remède.",1999,Romance
Cattle Queen of Montana,La Sierra Nevada Jones doit combattre un méchant éleveur pour regagner la terre qui lui appartient à juste titre.,1954,Western
Hiawatha,Un jeune Indien courageux tente d'apporter la paix à deux tribus en guerre.,1952,Western
The Shepherd of the Hills,"Le jeune Matt Masters, un Moonshiner des montagnes Ozark, déteste le père qu'il n'a jamais vu, qui a apparemment déserté la mère de Matt et l'a laissée mourir.Son obsession contribue à la haine rampante dans les montagnes.Cependant, l'arrivée d'un étranger, Daniel Howitt, commence à affecter positivement les gens des montagnes, qui apprennent à perdre leur haine sous sa douce influence",1941,Western
Historia Kina w Popielawach,"L'histoire est racontée par Staszek, dix ans, qui écrit dans son journal sur son ami de l'école.Jozef vient d'une famille de forgerons, qui portent tous le nom de Jozef.Puisqu'il est le sixième fils consécutif à s'appeler Jozef, il est surnommé Szustek (qui signifie ""sixième"").",1998,Romance
Shadowheart,"James Conners rentre à la maison dans la ville de Legend, au Nouveau-Mexique, en 1865, pour venger la mort de ses pères contre le Tunney impitoyable.En cours de route, il recapture son amour perdu depuis longtemps Mary Cooper.Avec la possibilité de prendre Will Tunney, il doit choisir la vengeance ou la rédemption.",2009,Western
Pleasure Cruise,"Roland Young et Geneviève Tobin sont mariés depuis un an, et ils ont l'impression de s'éloigner dans leur mariage.Ils décident qu'ils retireront des vacances séparées les uns des autres pour régler le mariage.Tobin décide de faire une croisière de plaisir, et à bord de nombreux hommes disponibles commencent à la frapper, et elle commence à envisager d'avoir une baisse rapide de la fling avec l'un des hommes.",1933,Romance
Voice from the Stone,"Situé dans les années 1950 en Toscane, la voix de la pierre est l'histoire obsédante et pleine de suspense de Verena, une infirmière solennelle dessinée pour aider un jeune garçon qui est devenu silencieux depuis le passage soudain de sa mère.",2017,Romance
The Hired Hand,"Harry Collings rentre chez lui dans sa ferme après avoir dérivé avec son ami, Arch.Sa femme, qui l'avait abandonné, lui permet à contrecœur de rester et croit bientôt que tout ira bien.Mais alors Harry doit prendre une décision difficile concernant sa loyauté et ses priorités.",1971,Western
Susannah of the Mounties,"Ce drame familial classique met en vedette Shirley Temple comme la jeune orpheline Susannah Sheldon, la seule survivante d'une attaque indienne brutale qui s'est liée d'amitié par la montagne canadienne Angus Montague (Randolph Scott) et sa petite amie, Vicky (Margaret Lockwood).Le couple prend Susannah sous leur aile et apprend bientôt qu'avoir un enfant précoce peut être utile;Lorsque les Indiens reviennent, la fille utilise son charme pour négocier la paix.Shirley est la survivante orpheline d'une attaque indienne dans l'Occident canadien.Une gendarme et sa petite amie l'emmène ...",1939,Western
Cheyenne Autumn,Un capitaine de cavalerie réticent doit suivre une tribu provocante de Cheyennes migrate.,1964,Western
LelleBelle,"Belle, 19 ans, s'entraîne à jouer du violon avec diligence, mais elle est incapable de transmettre sa musique avec une nuance sensible.Sa vie change lorsqu'elle découvre que le désir sexuel stimule la passion dans sa musique.",2010,Romance
Groupies bleiben nicht zum Frühstück,Une connexion amoureuse clique pour Lila lorsqu'elle revient à Berlin et rencontre Christopher - ne réalisant jamais qu'elle est tombée pour une rock star qui a signé un contrat pour rester célibataire à vie.,2010,Romance
Echo Park,"Désespéré de se promener de la riche encoche de Beverly Hills parfaite, Sophie se déplace à travers la ville vers un autre monde: Echo Park.Elle établit rapidement une connexion inattendue avec Alex, un beau voisin et expatrié britannique qui vend à contrecœur sa maison bien-aimée pour retourner à Londres.Au fil de l'été, une romance tirée par l'incertitude les oblige à réévaluer où chacun appartient.",2014,Romance
The Great Scout & Cathouse Thursday,"Sam Longwood, un homme frontalier qui a connu des jours meilleurs, espionne le partenaire de la mine d'or, Jack Colby, qui s'est enfui avec toute l'or d'une mine qu'ils prospectaient quinze ans plus tôt.Il raconte à ses autres partenaires de cette époque, Joe Knox et Billy, et ils confrontent Colby à exiger non seulement les mille dollars qu'il a pris, mais un ajout de cinquante-neuf mille pour leurs ennuis.Après avoir été contrecarré dans cette tentative, ils, et une pute éventuelle nommée jeudi, élaborent un plan pour kiler la femme de Colby, Nancy Sue, qui est coïncidé la vieille flamme de Sam, mais qui trouve que Nancy Sue n'est pas la douce fille dont Sam se souvient.",1976,Western
The Man Who Shot Liberty Valance,"Un sénateur, qui est devenu célèbre pour avoir tué un hors-la-loi notoire, revient pour les funérailles d'un vieil ami et dit la vérité sur son acte.",1962,Western
Itinéraire bis,"Jean, 35 ans, vit toujours avec sa mère dans un petit village en Corse et travaille comme cuisinier dans le restaurant de la famille.Son avenir, à son grand désespoir, est tout tracé: il reprendra le restaurant.Mais un jour, Nora, une femme jeune et énergique, est jetée dans la mer d'un yacht de course.Elle se lave sur la plage aux pieds de Jean - Adventure a enfin frappé à sa porte.",2011,Romance
The Wedding Pact,"Deux meilleurs amis du collège Mitch et Elizabeth concluent un pacte que si dans dix ans après l'obtention du diplôme, ils ne sont pas mariés, ils se marieront.Dix ans plus tard, Mitch (toujours célibataire) découvre qu'Elizabeth ne s'est jamais mariée, alors il décide de voyager à travers le pays, de la trouver et de suivre leur pacte.Ce qu'il réalise bientôt, c'est que ce ne sera pas simple comme il le pensait.",2014,Romance
Sing Street,Un garçon grandissant à Dublin dans les années 1980 échappe à sa vie de famille tendue en commençant un groupe pour impressionner la mystérieuse fille qu'il aime.,2016,Romance
100% లవ్,Balu (Naga Chaitanya) est un étudiant brillant et est toujours en tête de sa classe.Maha Lakshmi (Tamanna) est Maradalu de Balu et elle vient du village et reste dans la maison de Balu pour faire son diplôme dans le même collège.Balu a l'ego typique possédé par les rangs des États et il en est obsédé.Ses études sont dérangées par l'entrée à Maha Lakshmi alors qu'elle commence à le dominer sur une période de temps.Cela conduit à des différences et à des affrontements d'ego entre Balu et Maha Lakshmi.Il y a aussi une sous-intrigue de deux grands-parents séparés.Le reste de l'histoire concerne la façon dont Balu et Mahalakshmi se rendent compte qu'ils sont faits l'un pour l'autre.,2011,Romance
iGirl,"Evan, Johnny et Irwin sont les meilleurs amis depuis l'enfance.Un jour, tous les trois sont jetés par leurs copines.Bien que ivre, Evan rencontre un site Web appelé «Get Your Dream Igirl».Tout ce qu'il a besoin de faire est d'entrer dans les critères de sa fille de rêve et sur le paiement, il obtiendra ce qu'il veut. Sur une impulsion, Evan jette dans ses économies de vie.Il reçoit un colis contenant des parties d'un modèle humain, qu'il rassemble dans une figure de femme.Le lendemain, il trouve que le mannequin est vivant…",2016,Romance
Kid Vengeance,"L'une des deux coproductions italiennes-israéliennes de 1976 de 1976 avec Lee Van Cleef et Leif Garrett (Gianfranco Parolini Pistola di Dio était l'autre), ce spaghetti Western a en fait été abattu au Moyen-Orient par le réalisateur américain Joseph Manduke.La pop star Garrett joue Tom, une adolescente qui fait équipe avec un armoir noir nommé Isaac (Jim Brown) pour venger sa famille.Le coupable était McClain (Van Cleef), un hors-la-loi sadique qui a réalisé le viol-massacre brutal, mais son rôle est mineur, car la plupart du film traite de la maturation de Tom et se réconciliant avec ses sentiments.Les acteurs des personnages omniprésents des années 1970 Glynnis O'Connor et John Marley Co-star.S'il y a quelque chose de remarquable dans Kid Vengeance, c'est la fine score musicale de Francesco Masi, mais le film est autrement anémique.",1977,Western
Le due facce del dollaro,"Un enseignant, un tireur, un ex-colonel et une belle fille décident de voler une grande charge d'or stockée à Fort Henderson.La tâche n'est pas facile, car le fort est très bien gardé, mais avec des stratagèmes aventureux ...",1967,Western
"North and South, Book I","Deux amis, un nord et un sud, ont du mal à maintenir leur amitié à mesure que les événements se construisent vers la guerre civile américaine.",1985,Western
Fu Zi,"Après que sa mère fuit la maison familiale, un fils se tourne vers le voleur afin de soutenir son père, un type abusif qui est accro au jeu.",2006,Romance
さらば夏の光,"La configuration ici est un couple.Ils sont tous les deux japonais.Elle est mariée à un Européen, est hantée par la bombe de Nagasaki qui a tué son père.Les deux sont amoureux.",1968,Romance
Dirty Dancing,"Passer l'été dans une station balnéaire de Catskills avec sa famille, Frances ""Baby"" Houseman tombe amoureuse de l'instructeur de danse du camp, Johnny Castle, et rien n'est jamais le même pour quiconque dans la famille Houseman.Non seulement les chansons mémorables du film original sont incluses, mais il y a des chansons supplémentaires de l'époque qui seront présentées, ce qui montre le double du nombre de performances musicales de la distribution stellaire.",2017,Romance
Love on the Run,Une mariée en fuite et un journaliste infiltré se font prendre dans l'intrigue politique alors qu'ils mènent une joyeuse poursuite à travers l'Europe et découvrent un complot d'espion.,1936,Romance
Counting Backwards,"Pour certains, les vies que nous avons ne sont pas toujours la vie que nous voulions.Pour Joe, un petit gars de la petite ville de Sandwich, dans l'Illinois, le sien n'est même pas proche - jusqu'à présent.Face à la mort et ayant récemment rencontré la fille de ses rêves, Claire, Joe doit trouver un moyen de vivre la vie de la passion qu'il avait toujours voulu, et il doit le faire rapidement.Journey avec Joe vers le Grand Beyond, pas à moitié aussi imaginatif que le chemin qu'il a finalement forgé ici sur Terre.Roulez avec lui alors qu'il est obligé de comprendre le sens de la vie qu'il n'aura pas le temps de vivre.Avec l'aide de son meilleur ami, Frank, et sa mère brillante, sinon terrifiée, Sarah, Joe apprendra enfin à vivre, à aimer et à explorer au-delà de ses rêves les plus fous.Et nous pourrons regarder le voyage d'un homme se dérouler, dès le premier jour du reste de sa vie.",2007,Romance
Moonlight and Cactus,"Les sœurs d'Andrews swing offrent les interludes musicaux et la romance dans cet occidental.Ils jouent un trio d'éleveurs de l'ère de la Seconde Guerre mondiale.Qu'ils soient si doués pour courir, cela s'avère terrible pour une main de ranch qui vient de rentrer chez elle après avoir servi dans la Marine.",1944,Western
Exponerad,La jeune Lena est piégée dans une situation complexe de sexe et de mensonges.,1971,Romance
Conagher,"Mme Evie Teale a du mal à rester en vie tout en élevant ses deux enfants seuls sur une propriété isolée.Conn Conagher est un cow-boy honnête et travailleur.Leurs vies sont liées à la lutte contre les éléments, les Indiens, les hors-la-loi et la solitude.",1991,Western
